电影类别,备案立项号,片名,备案单位,编剧,备案结果,备案地,梗概,公示日期,公示批次名称,备案详细页链接,公示批次链接
故事影片,影剧备字〔2021〕第1505号,欢迎您再来,山西景辰未来影视传媒有限公司,汪洪、刘鹏飞、张琳,同意拍摄,山西省,郝有理与老板甄皮修闹掰辞职，回到家乡小溪村写了一篇虚假宣传当地美景的文章，结果文章大火，引来想靠旅行挽救婚姻的甄皮修夫妻。一行人在小溪村发生了一系列滑稽又感人的故事，最终推动了当地文旅产业发展。,2021-06-04,国家电影局关于2021年4月全国电影剧本（梗概）  备案、立项公示的通知-电影备案立项公示-国家电影局,http://www.chinafilm.gov.cn/chinafilm/utils/serviceContent.shtml?ID=56462,http://www.chinafilm.gov.cn/chinafilm/contents/167/3470.shtml
故事影片,影剧备字〔2021〕第1695号,烽烟南太行,山西微媒体文化传媒有限公司,赵光明,同意拍摄,山西省,牛金娃受晋城中心县委委派来到西土河村开展工作，发展党员，建立武装。牛金娃成功将西土河村带有迷信色彩的“红枪会”改造成抗日游击队，建立起党组织，粉碎了鬼子的征粮行动，并完成上级交办护送八路军首长的任务。,2021-06-04,国家电影局关于2021年4月全国电影剧本（梗概）  备案、立项公示的通知-电影备案立项公示-国家电影局,http://www.chinafilm.gov.cn/chinafilm/utils/serviceContent.shtml?ID=56463,http://www.chinafilm.gov.cn/chinafilm/contents/167/3470.shtml
故事影片,影剧备字〔2021〕第1570号,天机神宫之悬龙归墟,陕西广电影视文化产业发展有限公司,柳庆庆,同意拍摄,陕西省,本片描写了天机后人滕启啸，为获得自由，并寻找当年失踪的父亲，替当朝皇子晋王寻得天机宝物镇龙盘。而后却发现晋王意图炸毁镇龙盘，实现一统天下的狼子野心。最终，滕启啸为避免涂炭生灵，成功阻止晋王，保全镇龙盘,2021-06-04,国家电影局关于2021年4月全国电影剧本（梗概）  备案、立项公示的通知-电影备案立项公示-国家电影局,http://www.chinafilm.gov.cn/chinafilm/utils/serviceContent.shtml?ID=56464,http://www.chinafilm.gov.cn/chinafilm/contents/167/3470.shtml
故事影片,影剧备字〔2021〕第1498号,夜宿梨树湾,陕西华原文化产业投资发展有限公司,王冰峰,同意拍摄,陕西省,游击队员为救治红军伤员急需抗菌素盘尼西林，在运输途中遭到国民党军雷天一等人拦截。为保护药品不被敌军发现，将它藏在客栈并与土匪、国民党军在客栈斗智斗勇，在客栈老板等人的帮助下，终将药品安全送到根据地。,2021-06-04,国家电影局关于2021年4月全国电影剧本（梗概）  备案、立项公示的通知-电影备案立项公示-国家电影局,http://www.chinafilm.gov.cn/chinafilm/utils/serviceContent.shtml?ID=56465,http://www.chinafilm.gov.cn/chinafilm/contents/167/3470.shtml
故事影片,影剧备字〔2021〕第1717号,大都汇,陕西嘉轩天赋影视文化有限公司,李晓虎,同意拍摄,陕西省,大明赛车时发生意外兄弟闻西不幸离世。重情重义的他为了凑闻西母亲的手术费，再次赛车却输掉比赛。无奈向孙姿借钱却发生口角，慌乱中误伤了孙姿的兄弟，不知如何是好的他只能暂时躲避，却在此期间找到了人生的方向。,2021-06-04,国家电影局关于2021年4月全国电影剧本（梗概）  备案、立项公示的通知-电影备案立项公示-国家电影局,http://www.chinafilm.gov.cn/chinafilm/utils/serviceContent.shtml?ID=56466,http://www.chinafilm.gov.cn/chinafilm/contents/167/3470.shtml
故事影片,影剧备字〔2021〕第1520号,捌拾叁,陕西普诚泽瑞文化传媒有限公司,刘夏,同意拍摄,陕西省,为了完成母亲遗愿，给曾经保卫村庄的烈士们修建纪念碑，叶舒岭踏上了属于他的征程。一路上，他用自己的坚定信念和纯朴初心，收获了难得的友情。最终，在众多的帮助之下，纪念碑终于建成。,2021-06-04,国家电影局关于2021年4月全国电影剧本（梗概）  备案、立项公示的通知-电影备案立项公示-国家电影局,http://www.chinafilm.gov.cn/chinafilm/utils/serviceContent.shtml?ID=56467,http://www.chinafilm.gov.cn/chinafilm/contents/167/3470.shtml
故事影片,影剧备字〔2021〕第1715号,优游,陕西石榴影视文化传播有限公司,沈晓闽,同意拍摄,陕西省,讲述了贾阳和张波两个失落的人来到海岛，他们邂逅了曼珠华姐妹。七周的海岛之旅，四个年轻人经历了彼此的误会和摩擦，在追逐与被追逐之间产生了感情。他们在海岛各处游历，治愈了伤痛，重新思考人生并开始新生活。,2021-06-04,国家电影局关于2021年4月全国电影剧本（梗概）  备案、立项公示的通知-电影备案立项公示-国家电影局,http://www.chinafilm.gov.cn/chinafilm/utils/serviceContent.shtml?ID=56468,http://www.chinafilm.gov.cn/chinafilm/contents/167/3470.shtml
故事影片,影剧备字〔2021〕第1504号,不惑之年,陕西西咸新区秦汉新城影视发展有限公司、西咸新区橙蝶影视文化有限公司,李京玉,同意拍摄,陕西省,刘卫东早年丧妻后独自抚养着儿子刘志，成功企业家张国庆身为单亲父亲却一直搞不定儿子张峰，张国庆招聘专职司机的事，让他和刘卫东相遇。两个家庭通过不断碰撞，最终化解了各自的矛盾并在生活中相互包容，支持。,2021-06-04,国家电影局关于2021年4月全国电影剧本（梗概）  备案、立项公示的通知-电影备案立项公示-国家电影局,http://www.chinafilm.gov.cn/chinafilm/utils/serviceContent.shtml?ID=56469,http://www.chinafilm.gov.cn/chinafilm/contents/167/3470.shtml
故事影片,影剧备字〔2021〕第1566号,筑梦少年,陕西西影数码传媒科技有限责任公司,刘刚,同意拍摄,陕西省,假期都市日报小记者参加报社对贫困山村村民在党和政府的带领下脱贫致富采访报道，与当地的同龄小伙伴之间的友谊。同时小记者们想怎么能更好的宣传当地特产为村民做点贡献发生的其妙故事,2021-06-04,国家电影局关于2021年4月全国电影剧本（梗概）  备案、立项公示的通知-电影备案立项公示-国家电影局,http://www.chinafilm.gov.cn/chinafilm/utils/serviceContent.shtml?ID=56470,http://www.chinafilm.gov.cn/chinafilm/contents/167/3470.shtml
故事影片,影剧备字〔2021〕第1483号,终劫十二,陕西新弘晟晖影视制作发行有限公司、佛山天享影业有限公司、陕西华源浩海影视制作发行有限公司,张曙、谷国庆,同意拍摄,陕西省,民国初年，滨海港商会会长李三林女儿与多名幼童被掳，下落不明，多年前类似案件也浮出水面。三林与警察小森追查出各种线索均指向普度众生的救济会。他们接近谜底，解救孩童，但冥冥中一股势力正将魔掌伸向整个滨海。,2021-06-04,国家电影局关于2021年4月全国电影剧本（梗概）  备案、立项公示的通知-电影备案立项公示-国家电影局,http://www.chinafilm.gov.cn/chinafilm/utils/serviceContent.shtml?ID=56471,http://www.chinafilm.gov.cn/chinafilm/contents/167/3470.shtml
故事影片,影剧备字〔2021〕第1645号,我的协议女友,西安白露风河旅游文化传播有限公司、河北正天景合文化传媒有限公司,杨梓,同意拍摄,陕西省,叶梓夕陪“男友”返回老家看望病危的奶奶，无意中开启了她与“婆婆”和“奶奶”间一段爆笑又危机四伏的农村直播带货经历。男女主人公也在这复杂又变幻莫测的家庭关系中渐生情愫，最终两人在家人的撮合下成为真正情侣,2021-06-04,国家电影局关于2021年4月全国电影剧本（梗概）  备案、立项公示的通知-电影备案立项公示-国家电影局,http://www.chinafilm.gov.cn/chinafilm/utils/serviceContent.shtml?ID=56472,http://www.chinafilm.gov.cn/chinafilm/contents/167/3470.shtml
故事影片,影剧备字〔2021〕第1588号,梦想的足迹,西安二十一圈影视文化传媒有限公司,张奕辄、李锐,同意拍摄,陕西省,郑辉因父亲修脚工的身份而倍感屈辱。在一次激烈争吵将父亲气进ICU后，郑辉竟意外回到几十年前，与年轻时期的父亲重新结识。通过一段时间的相处，郑辉渐渐明白父亲的执着，选择与父亲和解，并帮助他实现未尽的梦想,2021-06-04,国家电影局关于2021年4月全国电影剧本（梗概）  备案、立项公示的通知-电影备案立项公示-国家电影局,http://www.chinafilm.gov.cn/chinafilm/utils/serviceContent.shtml?ID=56473,http://www.chinafilm.gov.cn/chinafilm/contents/167/3470.shtml
故事影片,影剧备字〔2021〕第1500号,半空有眼,西安九重天影视文化传播有限责任公司,张建勇 杜鹏孝,同意拍摄,陕西省,一个边区最大潜伏特务网的惊险破获故事。一个发生在解放前延安时期，隐蔽战线上罕为人知的事件。一个在民族大义面前，何去何从艰难抉择的历程。并最终牺牲自我走向光明，走向新中国的信仰故事。,2021-06-04,国家电影局关于2021年4月全国电影剧本（梗概）  备案、立项公示的通知-电影备案立项公示-国家电影局,http://www.chinafilm.gov.cn/chinafilm/utils/serviceContent.shtml?ID=56474,http://www.chinafilm.gov.cn/chinafilm/contents/167/3470.shtml
故事影片,影剧备字〔2021〕第1499号,苍穹青山,西安乐和影视文化传媒有限公司,任彦,同意拍摄,陕西省,植物学博士周志不顾女友秦露的反对，自愿扎根到秦岭山区林场基层一线从事生态保护，遇见了守护秦岭山区近40年的老护林员吕青山，两代护林人完成了接力守望，保护苍穹青山常绿，同时周志也挽回了女友的爱情。,2021-06-04,国家电影局关于2021年4月全国电影剧本（梗概）  备案、立项公示的通知-电影备案立项公示-国家电影局,http://www.chinafilm.gov.cn/chinafilm/utils/serviceContent.shtml?ID=56475,http://www.chinafilm.gov.cn/chinafilm/contents/167/3470.shtml
故事影片,影剧备字〔2021〕第1553号,税金马车,西安日月联合影视文化传播有限公司,白文光,同意拍摄,陕西省,故事讲述了民国时期在狂野西部人性厮杀的环境中，几路不明身份的人为抢夺税金马车占据了一个客栈，客栈女主人和伙计为了生存奋力反抗保护自己客栈的故事。,2021-06-04,国家电影局关于2021年4月全国电影剧本（梗概）  备案、立项公示的通知-电影备案立项公示-国家电影局,http://www.chinafilm.gov.cn/chinafilm/utils/serviceContent.shtml?ID=56476,http://www.chinafilm.gov.cn/chinafilm/contents/167/3470.shtml
故事影片,影剧备字〔2021〕第1714号,黑白城,西安日月联合影视文化传播有限公司,白文光,同意拍摄,陕西省,故事讲诉野马帮老大马青云被部下出卖，重伤出逃后失忆变成了县城里一个老实巴交的车夫陈安平，保安团队长为剿灭野马帮，恶意诬陷陈安平欲将他当成匪帮替罪羊，陈安平在逼迫下一步步变成匪徒马青云。,2021-06-04,国家电影局关于2021年4月全国电影剧本（梗概）  备案、立项公示的通知-电影备案立项公示-国家电影局,http://www.chinafilm.gov.cn/chinafilm/utils/serviceContent.shtml?ID=56477,http://www.chinafilm.gov.cn/chinafilm/contents/167/3470.shtml
故事影片,影剧备字〔2021〕第1587号,加油啊！三筒,西安识君影视文化有限公司,郭子圣,同意拍摄,陕西省,天听和妻子百合的离婚官司纠扯多年，强迫妻子离婚后必须把儿子三筒也一起带走。天听患了失忆症，已无力再照顾儿子，得知真相的百合终于释怀，而天听唯一的愿望就是希望儿子能永远好好的。,2021-06-04,国家电影局关于2021年4月全国电影剧本（梗概）  备案、立项公示的通知-电影备案立项公示-国家电影局,http://www.chinafilm.gov.cn/chinafilm/utils/serviceContent.shtml?ID=56478,http://www.chinafilm.gov.cn/chinafilm/contents/167/3470.shtml
故事影片,影剧备字〔2021〕第1688号,野营B计划,西安维恩艺术文化传播有限公司,黄磊,同意拍摄,陕西省,权锋和江小曼是新组合家庭的夫妻。姐姐权颖11岁，弟弟江涛9岁。姐弟水火不容。全家野营时父母走丢，姐弟克服种种困难后全家团聚，发现是父母和邻居暗中计划，理解了父母良苦用心并言归于好。,2021-06-04,国家电影局关于2021年4月全国电影剧本（梗概）  备案、立项公示的通知-电影备案立项公示-国家电影局,http://www.chinafilm.gov.cn/chinafilm/utils/serviceContent.shtml?ID=56479,http://www.chinafilm.gov.cn/chinafilm/contents/167/3470.shtml
故事影片,影剧备字〔2021〕第1716号,妈，抱一下,西安烟花易影视文化传媒有限公司,许冰,同意拍摄,陕西省,母亲因癌症入院治疗，儿子在二十多天里悉心陪护。可进入晚期的疾病让所有人都束手无策。这时候，儿子决心带母亲逃离病床，带她去完成一个此生未了的心愿。母亲虽然病逝路上，但儿子依然带着她来到了海边。,2021-06-04,国家电影局关于2021年4月全国电影剧本（梗概）  备案、立项公示的通知-电影备案立项公示-国家电影局,http://www.chinafilm.gov.cn/chinafilm/utils/serviceContent.shtml?ID=56480,http://www.chinafilm.gov.cn/chinafilm/contents/167/3470.shtml
故事影片,影剧备字〔2021〕第1689号,萧方圆传：缘起,新代码影业（陕西）有限公司、新代码影业（北京）有限公司,汪子祺,同意拍摄,陕西省,讲述萧方圆退伍后成为新代码集团马总的私人保镖，在一次出国行程中因天气原因飞机迫降中东某国，而该国国内国内政权动荡形势严峻。最后在中国驻该国使馆与国际友人多方帮助下成功护送马总安全离开该国，并找回所爱.,2021-06-04,国家电影局关于2021年4月全国电影剧本（梗概）  备案、立项公示的通知-电影备案立项公示-国家电影局,http://www.chinafilm.gov.cn/chinafilm/utils/serviceContent.shtml?ID=56481,http://www.chinafilm.gov.cn/chinafilm/contents/167/3470.shtml
故事影片,影剧备字〔2021〕第1648号,初愈,黛娜（上海）文化传播有限公司,邵雪峰,同意拍摄,上海市,上海某一室户住着一家五口，男主创业失败，人到中年一蹶不振，常年家里蹲。他包揽一切家务，把家里照顾的不错。而沉迷短视频的糊涂妻子，突患大病侥幸存活，焦虑，随后沉迷网络鸡汤鸡血文。勉强维持的平静不复存在。,2021-06-04,国家电影局关于2021年4月全国电影剧本（梗概）  备案、立项公示的通知-电影备案立项公示-国家电影局,http://www.chinafilm.gov.cn/chinafilm/utils/serviceContent.shtml?ID=56482,http://www.chinafilm.gov.cn/chinafilm/contents/167/3470.shtml
故事影片,影剧备字〔2021〕第1507号,全民明星,坏猴子（上海）文化传播有限公司,刘晓丹、赵天佑,同意拍摄,上海市,过气香港明星为了重新“翻红”，与某国内大导演合作影片《乡村教师》。他深入农村体验生活，却因为傲慢引发了一系列不可收场的闹剧。最终，他顿悟待人真诚才是最珍贵的品质，他的生活亦转变重拾美好。,2021-06-04,国家电影局关于2021年4月全国电影剧本（梗概）  备案、立项公示的通知-电影备案立项公示-国家电影局,http://www.chinafilm.gov.cn/chinafilm/utils/serviceContent.shtml?ID=56483,http://www.chinafilm.gov.cn/chinafilm/contents/167/3470.shtml
故事影片,影剧备字〔2021〕第1545号,爸妈我爱你,磐龙（上海）文化传播有限公司,陈小艺,同意拍摄,上海市,亚东为完成员工心愿，带女友前往村镇网点亲自配送四个找不到收件人的包裹，亚东和女友发现了包裹背后是四个留守孩子令人感动的故事和秘密，孩子们也解开了对父母的误解，并深刻感受到来自爸妈的爱。,2021-06-04,国家电影局关于2021年4月全国电影剧本（梗概）  备案、立项公示的通知-电影备案立项公示-国家电影局,http://www.chinafilm.gov.cn/chinafilm/utils/serviceContent.shtml?ID=56484,http://www.chinafilm.gov.cn/chinafilm/contents/167/3470.shtml
故事影片,影剧备字〔2021〕第1617号,风尘三侠,青鸟影业（上海）有限公司,高凡,同意拍摄,上海市,李靖于隋末在长安谒见司空杨素，为杨素家妓红拂所倾慕，随之出奔，途中结识豪侠虬髯客，同至太原，虬髯客本有争夺天下之志，听说李世民神气不凡，知不能匹敌，遂独自离去。李靖、红拂、虬髯三人，后人亦称风尘三侠。,2021-06-04,国家电影局关于2021年4月全国电影剧本（梗概）  备案、立项公示的通知-电影备案立项公示-国家电影局,http://www.chinafilm.gov.cn/chinafilm/utils/serviceContent.shtml?ID=56485,http://www.chinafilm.gov.cn/chinafilm/contents/167/3470.shtml
故事影片,影剧备字〔2021〕第1703号,迷航昆仑墟之乾坤诀,上海斐儿文化传播有限公司,颜彬,同意拍摄,上海市,张艺军女朋友离奇自杀并消失，他闯入魔幻般的宝瓶，历经艰难险阻，面对“摔掉宝瓶女朋友会死；留着宝瓶，世人会受到情绪污染”的两难。他们经历生离死别后，明白了：只要不能摆脱自己的情绪，就永远也不能战胜自己。,2021-06-04,国家电影局关于2021年4月全国电影剧本（梗概）  备案、立项公示的通知-电影备案立项公示-国家电影局,http://www.chinafilm.gov.cn/chinafilm/utils/serviceContent.shtml?ID=56486,http://www.chinafilm.gov.cn/chinafilm/contents/167/3470.shtml
故事影片,影剧备字〔2021〕第1704号,迷航昆仑墟之阴阳诀,上海斐儿文化传播有限公司,沈诗棋,同意拍摄,上海市,本片以“舒适安逸”的阳瓶代表了不劳而获的欲望；以“痛苦险恶”的阴瓶代表了奋斗中的艰辛。最终阴阳互换，困难使人奋进，安逸使人停滞。小张经历一夜暴富和九死一生后终于明白：幸福生活都是奋斗出来的。,2021-06-04,国家电影局关于2021年4月全国电影剧本（梗概）  备案、立项公示的通知-电影备案立项公示-国家电影局,http://www.chinafilm.gov.cn/chinafilm/utils/serviceContent.shtml?ID=56487,http://www.chinafilm.gov.cn/chinafilm/contents/167/3470.shtml
故事影片,影剧备字〔2021〕第1605号,爸爸妈妈别离开我,上海亥母影业集团有限公司,马响,同意拍摄,上海市,家庭就像是社会的细胞，完整的家庭不仅是个人美好生活的起点，也是优良人格形成的源头。爸爸妈妈别离开我，从孩子的视角来呼唤亲情，唤醒人们对孩子、爱情，家庭及社会责任的担当......,2021-06-04,国家电影局关于2021年4月全国电影剧本（梗概）  备案、立项公示的通知-电影备案立项公示-国家电影局,http://www.chinafilm.gov.cn/chinafilm/utils/serviceContent.shtml?ID=56488,http://www.chinafilm.gov.cn/chinafilm/contents/167/3470.shtml
故事影片,影剧备字〔2021〕第1543号,路由器惊魂,上海浩林文化传播股份有限公司,曹茹莎,同意拍摄,上海市,讲述了一对新婚夫妻从爱情走入婚姻，遭遇现实责难后的挣扎与对抗，最终解开误会，携手克服困难，感受婚姻真谛的故事。,2021-06-04,国家电影局关于2021年4月全国电影剧本（梗概）  备案、立项公示的通知-电影备案立项公示-国家电影局,http://www.chinafilm.gov.cn/chinafilm/utils/serviceContent.shtml?ID=56489,http://www.chinafilm.gov.cn/chinafilm/contents/167/3470.shtml
故事影片,影剧备字〔2021〕第1616号,仙人掌日记,上海井树文化传媒有限公司,刘东,同意拍摄,上海市,2008年一所三线小城的大学校园中，武楠君、杨帆、朱丽阳、陈芳菲四个女孩在最美的年华，用最真的友谊，迸发出战胜病魔和死神的巨大能量，救助患白血病的舍友孟海琴的故事。,2021-06-04,国家电影局关于2021年4月全国电影剧本（梗概）  备案、立项公示的通知-电影备案立项公示-国家电影局,http://www.chinafilm.gov.cn/chinafilm/utils/serviceContent.shtml?ID=56490,http://www.chinafilm.gov.cn/chinafilm/contents/167/3470.shtml
故事影片,影剧备字〔2021〕第1569号,女神变身记,上海咖乐影业有限公司,陈颖杰,同意拍摄,上海市,看似平凡无奇的502，经历过挫败与嘲弄，依然坚持本我与真心，即使没有裹着华丽的外衣，善良乐观让他们收获了真实的情感和友谊，年少的他们人生路还要继续走下去，加油吧，天使般的少年们！,2021-06-04,国家电影局关于2021年4月全国电影剧本（梗概）  备案、立项公示的通知-电影备案立项公示-国家电影局,http://www.chinafilm.gov.cn/chinafilm/utils/serviceContent.shtml?ID=56491,http://www.chinafilm.gov.cn/chinafilm/contents/167/3470.shtml
故事影片,影剧备字〔2021〕第1523号,漫漫长日,上海晓年青文化传媒有限公司,王子川,同意拍摄,上海市,刚转校到新班级的朱同是班上学习成绩最差的学生，初来乍到的他在班里也格格不入。他在校园里经历了非同寻常的一天，现实与奇幻的想象交织在一起，让朱同得到了成长。,2021-06-04,国家电影局关于2021年4月全国电影剧本（梗概）  备案、立项公示的通知-电影备案立项公示-国家电影局,http://www.chinafilm.gov.cn/chinafilm/utils/serviceContent.shtml?ID=56492,http://www.chinafilm.gov.cn/chinafilm/contents/167/3470.shtml
故事影片,影剧备字〔2021〕第1594号,迟来的爱,上海亦秋影业有限公司,徐权,同意拍摄,上海市,小东和外婆一起生活，外婆年迈又有病，她希望去世前为小东找到爸爸。小东找来马路假冒自己的爸爸以讨外婆欢心，不明真相的外婆将小东托付给了他。这一对非血缘关系的父子在每日的相处中，慢慢产生了真正的父子深情。,2021-06-04,国家电影局关于2021年4月全国电影剧本（梗概）  备案、立项公示的通知-电影备案立项公示-国家电影局,http://www.chinafilm.gov.cn/chinafilm/utils/serviceContent.shtml?ID=56493,http://www.chinafilm.gov.cn/chinafilm/contents/167/3470.shtml
故事影片,影剧备字〔2021〕第1647号,烦恼外星人,上海影萌科技有限公司,王鹏,同意拍摄,上海市,故事借外星虫人对人类社会的探索之旅，演绎现代都市人的生活。表面是外星科幻，实则表现的是人在家庭，事业中遇到的问题。情感和利益面前我们该如何取舍。真假虚实名利起伏，永恒的是以理服人，以诚信人，以情化人。,2021-06-04,国家电影局关于2021年4月全国电影剧本（梗概）  备案、立项公示的通知-电影备案立项公示-国家电影局,http://www.chinafilm.gov.cn/chinafilm/utils/serviceContent.shtml?ID=56494,http://www.chinafilm.gov.cn/chinafilm/contents/167/3470.shtml
故事影片,影剧备字〔2021〕第1519号,复活的恋人,上海勇士影业有限公司,张勇,同意拍摄,上海市,未来人工智能高度发达。女友雅去世。张洋申请一个智能机器人P08。雅又神奇出现，自称来自未来，逼张洋毁灭P08。张洋发现，复活的雅是一个更高端的智能机器人，而她的到来还隐藏着一个巨大阴谋。,2021-06-04,国家电影局关于2021年4月全国电影剧本（梗概）  备案、立项公示的通知-电影备案立项公示-国家电影局,http://www.chinafilm.gov.cn/chinafilm/utils/serviceContent.shtml?ID=56495,http://www.chinafilm.gov.cn/chinafilm/contents/167/3470.shtml
故事影片,影剧备字〔2021〕第1705号,风一样的她,泰海影业文化传播（上海）有限公司,杨承融,同意拍摄,上海市,年过半百的钱先生与太太发生感情问题，太太要离开前往东京，钱先生得知同行航班还有一直对太太图谋不轨的岳老板，于是决定前往机场挽留太太。从而上演了一场坎坷的挽留爱情的故事。,2021-06-04,国家电影局关于2021年4月全国电影剧本（梗概）  备案、立项公示的通知-电影备案立项公示-国家电影局,http://www.chinafilm.gov.cn/chinafilm/utils/serviceContent.shtml?ID=56496,http://www.chinafilm.gov.cn/chinafilm/contents/167/3470.shtml
故事影片,影剧备字〔2021〕第1571号,夏天里的四季,晚睡晚起（上海）影视文化工作室,刘鉴,同意拍摄,上海市,影片讲述了男主夏凡和三个朋友二十年里，从初中、高中、大学、就业直到中年，经历了爱情、现实的婚姻、朋友的背叛和一起看过的世界杯。,2021-06-04,国家电影局关于2021年4月全国电影剧本（梗概）  备案、立项公示的通知-电影备案立项公示-国家电影局,http://www.chinafilm.gov.cn/chinafilm/utils/serviceContent.shtml?ID=56497,http://www.chinafilm.gov.cn/chinafilm/contents/167/3470.shtml
